{
  "$schema": "https://json-schema.org/draft/2020-12/schema",
  "$id": "https://schemas.kumwe.org/studio/v1/host-capabilities.schema.json",
  "title": "Studio host capabilities",
  "type": "object",
  "additionalProperties": false,
  "required": ["contractVersion", "kind", "host", "protocolVersions", "ports", "capabilities"],
  "properties": {
    "contractVersion": { "$ref": "common.schema.json#/$defs/contractVersion" },
    "kind": { "const": "host-capabilities" },
    "host": {
      "type": "object",
      "additionalProperties": false,
      "required": ["id", "version", "generation"],
      "properties": {
        "id": { "$ref": "common.schema.json#/$defs/qualifiedName" },
        "version": { "$ref": "common.schema.json#/$defs/semanticVersion" },
        "generation": { "$ref": "common.schema.json#/$defs/revision" }
      }
    },
    "protocolVersions": {
      "type": "array",
      "minItems": 1,
      "maxItems": 20,
      "uniqueItems": true,
      "items": { "$ref": "common.schema.json#/$defs/semanticVersion" }
    },
    "ports": {
      "type": "array",
      "maxItems": 100,
      "items": {
        "type": "object",
        "additionalProperties": false,
        "required": ["id", "version", "operations"],
        "properties": {
          "id": { "$ref": "common.schema.json#/$defs/qualifiedName" },
          "version": { "$ref": "common.schema.json#/$defs/semanticVersion" },
          "operations": {
            "type": "array",
            "minItems": 1,
            "maxItems": 100,
            "uniqueItems": true,
            "items": { "$ref": "common.schema.json#/$defs/qualifiedName" }
          }
        }
      }
    },
    "capabilities": {
      "type": "array",
      "maxItems": 500,
      "items": {
        "type": "object",
        "additionalProperties": false,
        "required": ["id", "version"],
        "properties": {
          "id": { "$ref": "common.schema.json#/$defs/qualifiedName" },
          "version": { "$ref": "common.schema.json#/$defs/semanticVersion" },
          "configuration": { "$ref": "common.schema.json#/$defs/jsonValue" }
        }
      }
    },
    "extensions": { "$ref": "common.schema.json#/$defs/extensions" }
  }
}
